sure,soru,a,b,c,d,cevap
15,Hikâye hangi mevsimde geçiyor?,Kış,Sonbahar,Yaz,İlkbahar,2
30,Alp ve Gökçe neyle oynuyorlardı?,Top,İp,Frizbi,Kum,0
45,İpek Ali ve Zeynep ne yapıyorlardı?,Saklambaç oynuyorlardı,İp atlıyorlardı,Top oynuyorlardı,Resim yapıyorlardı,1
60,Çocuklara limonata getiren kimdi?,Fatma teyze,Ayşe teyze,Emine teyze,Hasan amca,1
75,Ayşe teyze çocuklara ne getirdi?,Kurabiye,Limonata,Kek,Meyve suyu,1
90,Fatma teyze çocuklara ne getirdi?,Kek,Limonata,Su,Kurabiye,3
105,Fatma teyze çocuklara ne söyledi?,Biraz sessiz olun dedi,Limonatanın yanına kurabiye de iyi gider dedi,Bahçeyi sulayın dedi,Ders çalışın dedi,1
120,Hasan amca ve Emine teyze nereden dönüyordu?,Parktan,Pazardan,Okuldan,Hastaneden,1
135,Hasan amcanın elindeki fileler nasıldı?,Boştu,Çok hafifti,Çok ağırdı,Renkliydi,2
